rule_id,provider,service,category,severity,title,description,check_type,complexity,threat_category,mitre_tactics,mitre_techniques,risk_score,domain,action_category,posture_category,frameworks,compliance_ids,source_file
k8s.apiserver.audit.authentication_failure_chain,k8s,apiserver,audit,MEDIUM,Identify patterns of consecutive failed authentication requests to the Kubernetes API server.,Identify patterns of consecutive failed authentication requests to the Kubernetes API server.,log,L6_CIEM_EVENT,reconnaissance,discovery,T1580,55,logging_monitoring_and_alerting,read,security_posture,NIST_800_171,NIST_800_171/3.1.8,k8s_rule_ciem/apiserver/k8s.apiserver.audit.authentication_failure_chain.yaml
k8s.audit.chain.replay_credential_use,k8s,audit,chain,HIGH,Detect behavioral chains of credential reuse across pods/nodes indicating potential replay attacks in audit logs.,Detect behavioral chains of credential reuse across pods/nodes indicating potential replay attacks in audit logs.,log_correlation,L7_CIEM_CHAIN,credential_access,credential_access,T1552,75,logging_monitoring_and_alerting,read,security_posture,NIST_800_171,NIST_800_171/3.5.4,k8s_rule_ciem/audit/k8s.audit.chain.replay_credential_use.yaml
k8s.container.audit.auditd_mount_tamper,k8s,container,audit,HIGH,Detect container auditd socket mount tampering and DaemonSet deployments that bypass host audit logging,Detect container auditd socket mount tampering and DaemonSet deployments that bypass host audit logging,log,L6_CIEM_EVENT,defense_evasion,defense_evasion,T1562,75,logging_monitoring_and_alerting,delete,security_posture,CIS,CIS/5.7.2,k8s_rule_ciem/container/k8s.container.audit.auditd_mount_tamper.yaml
k8s.falco.audit.disable,k8s,falco,audit,HIGH,Detect disabling of Falco runtime malware detection audit logs or tampering with Fluentd log forwarding to evade anti-malware audit retention.,Detect disabling of Falco runtime malware detection audit logs or tampering with Fluentd log forwarding to evade anti-malware audit retention.,log,L6_CIEM_EVENT,defense_evasion,defense_evasion,T1562,75,logging_monitoring_and_alerting,delete,security_posture,PCI_DSS,PCI_DSS/5.3.4,k8s_rule_ciem/falco/k8s.falco.audit.disable.yaml
k8s.node.chain.time_ntp_disable,k8s,node,chain,HIGH,"Detect multi-step patterns to disable NTP on cluster nodes or disable audit webhooks, undermining time synchronization for event correlation.","Detect multi-step patterns to disable NTP on cluster nodes or disable audit webhooks, undermining time synchronization for event correlation.",log_correlation,L7_CIEM_CHAIN,defense_evasion,defense_evasion,T1562,75,security_posture,delete,security_posture,PCI_DSS,PCI_DSS/10.6.1,k8s_rule_ciem/node/k8s.node.chain.time_ntp_disable.yaml
