yaml_rule_id,yaml_service,yaml_resource_kind,domain,severity,scope,assertion_id,ai_confidence,ai_reasoning,top_candidate_pool
aws.acm-pca.certificateauthority.cloudwatch_audit_logging,acm-pca,certificateauthority,secrets_and_key_management,high,acm-pca.certificateauthority.logging,key_management.acm_pca_certificateauthority_cloudwatch_audit_logging,none,"The config rule is for ACM PCA (AWS Certificate Manager Private Certificate Authority) CloudWatch audit logging, but all candidate rules are for different AWS services (e.g., CloudWatch, Redshift, DocumentDB, EKS, Glue, etc.) and do not cover ACM PCA.",cloudtrail.cloudwatch.logging.enabled(0.4); redshift.cluster.audit.logging(0.4); aws.documentdb.cluster.cloudwatch_log_export:aws.documentdb.cluster.audit_logging_enabled(0.375); aws.eks.cluster.audit_logging_enabled(0.333); aws.redshift.cluster.audit_logging_enabled(0.333)
aws.acm-pca.certificateauthority.enabled_and_active,acm-pca,certificateauthority,secrets_and_key_management,high,acm-pca.certificateauthority.status,key_management.acm_pca_certificateauthority_enabled_and_active,none,"The config rule checks ACM PCA certificate authority status (enabled/active), while all candidates focus on logging, metrics, versioning, or service enablement for different AWS services.",aws.glue.job.logs_and_metrics_enabled(0.286); aws.glue.job.logs_and_metrics_enabled(0.286); aws.glue.job.logs_and_metrics_enabled(0.286); aws.eventbridge.rule.logs_and_metrics_enabled(0.286); aws.glue.workflow.logs_and_metrics_enabled(0.286)
aws.acm-pca.certificateauthority.revocation_configured,acm-pca,certificateauthority,secrets_and_key_management,high,acm-pca.certificateauthority.revocation,key_management.acm_pca_certificateauthority_revocation_configured,none,"All candidate rules are for API Gateway, API Gateway v2, or CloudWatch logging controls, unrelated to ACM PCA certificate authority revocation configuration.",aws.api_gateway.stage.api_access_logging_enabled(0.0); aws.api_gatewayv2.stage.api_access_logging_enabled(0.0); aws.cloudwatch.metric.api_access_logging_enabled(0.0); aws.api_gateway.stage.api_access_log_sink_configured(0.0); aws.api_gatewayv2.stage.api_access_log_sink_configured(0.0)
aws.apigateway.resource.api_resource_attached_enabled,apigateway,resource,configuration_and_change_management,medium,apigateway.resource.configuration,security.configuration.apigateway_resource_api_resource_attached_enabled,none,"The config rule checks if API Gateway resources are properly attached to APIs, while all candidates focus on unrelated controls like WAF attachment, logging, validation, authorization, certificates, or throttling.",aws.api_gateway.rest_api.waf_attached(0.4); aws.api_gateway.v2_api.waf_attached(0.4); aws.apigatewayv2.api_access_logging_enabled(0.4); aws.api_gateway.stage.api_access_logging_enabled(0.333); aws.api_gatewayv2.stage.api_access_logging_enabled(0.333)
aws.apigatewayv2.stage.api_access_log_fields_identity_configured,apigatewayv2,stage,logging_monitoring_and_alerting,medium,apigatewayv2.stage.logging,logging_monitoring.logging.apigatewayv2_stage_api_access_log_fields_identity_configured,none,"The config rule checks for specific identity fields in API Gateway v2 access logs, while all candidates only check if access logging is enabled without verifying log content.",aws.apigatewayv2.api_access_logging_enabled(0.429); aws.apigatewayv2.api_access_logging_enabled:nan(0.429); apigatewayv2.api.access.logging.enabled(0.429)
aws.apigatewayv2.stage.api_burst_limit_configured,apigatewayv2,stage,configuration_and_change_management,medium,apigatewayv2.stage.configuration,security.configuration.apigatewayv2_stage_api_burst_limit_configured,none,"The config rule checks for API Gateway V2 stage burst limit configuration, while all candidates are about access logging, which is unrelated to rate limiting or burst limits.",aws.apigatewayv2.api_access_logging_enabled(0.143); aws.apigatewayv2.api_access_logging_enabled:nan(0.143); apigatewayv2.api.access.logging.enabled(0.143)
aws.apigatewayv2.stage.api_execution_logging_level_minimum_error_configured,apigatewayv2,stage,logging_monitoring_and_alerting,medium,apigatewayv2.stage.logging,logging_monitoring.logging.apigatewayv2_stage_api_execution_logging_level_minimum_error_configured,none,"The config rule checks for minimum error logging level on API Gateway v2 stage execution logs, while all candidates only check for access logging being enabled, which are different logging types and controls.",aws.apigatewayv2.api_access_logging_enabled(0.222); aws.apigatewayv2.api_access_logging_enabled:nan(0.222); apigatewayv2.api.access.logging.enabled(0.222)
aws.apigatewayv2.stage.api_logs_retention_days_minimum,apigatewayv2,stage,logging_monitoring_and_alerting,medium,apigatewayv2.stage.logging,logging_monitoring.logging.apigatewayv2_stage_api_logs_retention_days_minimum,none,"The config rule enforces a minimum retention period for API Gateway v2 stage logs, while all candidates only check if logging is enabled without addressing retention duration.",aws.apigatewayv2.api_access_logging_enabled(0.25); aws.apigatewayv2.api_access_logging_enabled:nan(0.25); apigatewayv2.api.access.logging.enabled(0.25)
aws.apigatewayv2.stage.api_quota_limit_configured,apigatewayv2,stage,configuration_and_change_management,medium,apigatewayv2.stage.configuration,security.configuration.apigatewayv2_stage_api_quota_limit_configured,none,"The config rule checks for API quota limits on API Gateway v2 stages, while all candidates only address access logging, which is unrelated to quota configuration.",aws.apigatewayv2.api_access_logging_enabled(0.143); aws.apigatewayv2.api_access_logging_enabled:nan(0.143); apigatewayv2.api.access.logging.enabled(0.143)
aws.apigatewayv2.stage.api_rate_limit_configured,apigatewayv2,stage,configuration_and_change_management,medium,apigatewayv2.stage.configuration,security.configuration.apigatewayv2_stage_api_rate_limit_configured,none,"The config rule checks for API rate limit configuration on API Gateway v2 stages, while all candidates only address access logging, which is unrelated to rate limiting.",aws.apigatewayv2.api_access_logging_enabled(0.143); aws.apigatewayv2.api_access_logging_enabled:nan(0.143); apigatewayv2.api.access.logging.enabled(0.143)
aws.apigatewayv2.stage.api_throttle_overrides_bounded,apigatewayv2,stage,configuration_and_change_management,medium,apigatewayv2.stage.configuration,security.configuration.apigatewayv2_stage_api_throttle_overrides_bounded,none,"The config rule checks for bounded throttle overrides in API Gateway V2 stages, while all candidates only address access logging, which is unrelated to throttling controls.",aws.apigatewayv2.api_access_logging_enabled(0.125); aws.apigatewayv2.api_access_logging_enabled:nan(0.125); apigatewayv2.api.access.logging.enabled(0.125)
aws.apigatewayv2.stage.api_usage_plan_required_for_api_keys,apigatewayv2,stage,configuration_and_change_management,medium,apigatewayv2.stage.configuration,security.configuration.apigatewayv2_stage_api_usage_plan_required_for_api_keys,none,"The config rule enforces usage plans for API keys on API Gateway v2 stages, while all candidates only check for access logging, which is unrelated to API key management.",aws.apigatewayv2.api_access_logging_enabled(0.1); aws.apigatewayv2.api_access_logging_enabled:nan(0.1); apigatewayv2.api.access.logging.enabled(0.1)
aws.cloudtrail.config_changes_monitoring.config_changes_monitoring_configured,cloudtrail,config_changes_monitoring,logging_monitoring_and_alerting,medium,cloudtrail.config_changes_monitoring.logging,logging_monitoring.monitoring.cloudtrail_config_changes_monitoring_config_changes_monitoring_configured,none,"The YAML rule focuses on monitoring configuration changes via CloudTrail, but all candidates either target specific resource changes (e.g., NACL, VPC) or alert destinations, not the general config changes monitoring intent.",aws.cloudtrail.config_changes_monitoring:aws.cloudtrail.trail.alert_destinations_configured(0.25); aws.cloudtrail.nacl_change_monitoring_configuration_check:aws.cloudtrail.trail.alert_destinations_configured(0.222); aws.cloudtrail.organizations_changes_monitoring_setup:aws.cloudtrail.trail.alert_destinations_configured(0.222); aws.cloudtrail.vpc_changes_monitoring_enabled:aws.cloudtrail.trail.flow_logs_enabled(0.2); aws.cloudtrail.policy.change_monitoring:aws.cloudtrail.trail.alert_destinations_configured(0.111)
aws.cloudtrail.console_auth_failures_monitoring.console_auth_failures_monitoring_configured,cloudtrail,console_auth_failures_monitoring,logging_monitoring_and_alerting,medium,cloudtrail.console_auth_failures_monitoring.logging,logging_monitoring.monitoring.cloudtrail_console_auth_failures_monitoring_console_auth_failures_monitoring_configured,none,"The config rule specifically monitors console authentication failures, but none of the candidate rules address this exact monitoring control for CloudTrail.",aws.cloudtrail.console_auth_failures_monitoring:aws.cloudtrail.trail.alert_destinations_configured(0.333); aws.cloudtrail.account.usage_monitoring_config:aws.cloudtrail.trail.alert_destinations_configured(0.091); aws.cloudtrail.nacl_change_monitoring_configuration_check:aws.cloudtrail.trail.alert_destinations_configured(0.091); aws.cloudtrail.organizations_changes_monitoring_setup:aws.cloudtrail.trail.alert_destinations_configured(0.091); aws.cloudtrail.vpc_changes_monitoring_enabled:aws.cloudtrail.trail.flow_logs_enabled(0.083)
aws.cloudtrail.nacl_event_selectors_monitoring.nacl_event_selectors_monitoring_configured,cloudtrail,nacl_event_selectors_monitoring,logging_monitoring_and_alerting,medium,cloudtrail.nacl_event_selectors_monitoring.logging,logging_monitoring.monitoring.cloudtrail_nacl_event_selectors_monitoring_nacl_event_selectors_monitoring_configured,none,"The YAML rule focuses on NACL event selectors monitoring in CloudTrail, but none of the candidate rules address NACL-specific monitoring or event selectors configuration.",aws.cloudtrail.nacl_event_selectors_monitoring:aws.cloudtrail.trail.alert_destinations_configured(0.333); aws.cloudtrail.nacl_change_monitoring_configuration_check:aws.cloudtrail.trail.alert_destinations_configured(0.2); aws.cloudtrail.account.usage_monitoring_config:aws.cloudtrail.trail.alert_destinations_configured(0.091); aws.cloudtrail.organizations_changes_monitoring_setup:aws.cloudtrail.trail.alert_destinations_configured(0.091); aws.cloudtrail.vpc_changes_monitoring_enabled:aws.cloudtrail.trail.flow_logs_enabled(0.083)
aws.cloudtrail.route_table_changes_metric_filter_alarm_monitoring.route_table_changes_monitored,cloudtrail,route_table_changes_metric_filter_alarm_monitoring,logging_monitoring_and_alerting,medium,cloudtrail.route_table_changes_metric_filter_alarm_monitoring.logging,logging_monitoring.monitoring.cloudtrail_route_table_changes_metric_filter_alarm_monitoring_route_table_changes_monitored,none,"The config rule specifically monitors route table changes via CloudTrail metric filters and alarms, but all candidates focus on alert destinations, flow logs, or unrelated monitoring types without addressing route table changes.",aws.cloudtrail.route_table_changes_metric_filter_alarm_monitoring:aws.cloudtrail.trail.alert_destinations_configured(0.462); aws.cloudtrail.route_table_changes_metric_filter_alarm:aws.cloudtrail.trail.alert_destinations_configured(0.385); aws.cloudtrail.nacl_change_monitoring_configuration_check:aws.cloudtrail.trail.alert_destinations_configured(0.143); aws.cloudtrail.organizations_changes_monitoring_setup:aws.cloudtrail.trail.alert_destinations_configured(0.143); aws.cloudtrail.vpc_changes_monitoring_enabled:aws.cloudtrail.trail.flow_logs_enabled(0.133)
aws.cloudwatch.alarm_cpu_utilization_configured.alarm_cloudwatch_alarm_cpu_utilization_configured,cloudwatch,alarm_cpu_utilization_configured,configuration_and_change_management,medium,cloudwatch.alarm_cpu_utilization_configured.configuration,security.configuration.cloudwatch_alarm_cpu_utilization_configured_alarm_cloudwatch_alarm_cpu_utilization_configured,none,"The config rule is about CPU utilization alarms, but none of the candidates specifically address CPU utilization or general alarm configuration for CPU metrics.",aws.cloudwatch.alarm_cpu_utilization_configured:aws.cloudwatch.alarm.alerts_for_rpo_rto_breach_configured(0.4); aws.cloudwatch.alarm_memory_utilization_configured:aws.cloudwatch.alarm.alerts_for_rpo_rto_breach_configured(0.273); aws.cloudwatch.alarm_configured:aws.cloudwatch.metric.flow_logs_enabled(0.222); aws.cloudwatch.group.not_publicly_accessible:aws.cloudwatch.alarm.alarm_actions_configured(0.222); aws.cloudwatch.log_metric_filter_alarm_configured:aws.cloudwatch.alarm.alarm_actions_configured(0.222)
aws.cloudwatch.alarm_memory_utilization_configured.alarm_cloudwatch_alarm_memory_utilization_configured,cloudwatch,alarm_memory_utilization_configured,configuration_and_change_management,medium,cloudwatch.alarm_memory_utilization_configured.configuration,security.configuration.cloudwatch_alarm_memory_utilization_configured_alarm_cloudwatch_alarm_memory_utilization_configured,none,"The YAML rule specifically checks for memory utilization alarms, but none of the candidate rules address memory utilization or similar resource-specific monitoring.",aws.cloudwatch.alarm_memory_utilization_configured:aws.cloudwatch.alarm.alerts_for_rpo_rto_breach_configured(0.4); aws.cloudwatch.alarm_cpu_utilization_configured:aws.cloudwatch.alarm.alerts_for_rpo_rto_breach_configured(0.273); aws.cloudwatch.alarm_configured:aws.cloudwatch.metric.flow_logs_enabled(0.222); aws.cloudwatch.group.not_publicly_accessible:aws.cloudwatch.alarm.alarm_actions_configured(0.222); aws.cloudwatch.log_metric_filter_alarm_configured:aws.cloudwatch.alarm.alarm_actions_configured(0.222)
aws.directconnect.connection_redundancy.directconnect_connection_redundancy_configured,directconnect,connection_redundancy,configuration_and_change_management,medium,directconnect.connection_redundancy.configuration,security.configuration.directconnect_connection_redundancy_directconnect_connection_redundancy_configured,none,"The config rule checks for connection redundancy configuration, while all candidates focus on encryption, tunnel monitoring, or key rotation aspects unrelated to redundancy.",aws.directconnect.connection_redundancy:aws.directconnect.connection.ike_phase_encryption_strong(0.25); aws.directconnect.virtual_interface_redundancy:aws.directconnect.connection.ike_phase_encryption_strong(0.2); aws.directconnect.connection.ike_phase_encryption_strong(0.143); aws.directconnect.connection.tunnel_health_monitoring_enabled(0.143); aws.directconnect.connection.pre_shared_keys_rotation_policy_defined(0.111)
aws.directconnect.virtual_interface_redundancy.directconnect_virtual_interface_redundancy_configured,directconnect,virtual_interface_redundancy,configuration_and_change_management,medium,directconnect.virtual_interface_redundancy.configuration,security.configuration.directconnect_virtual_interface_redundancy_directconnect_virtual_interface_redundancy_configured,none,"The config rule checks for virtual interface redundancy configuration, while all candidates focus on encryption, tunnel monitoring, or key rotation for connections, with no overlap in control intent.",aws.directconnect.virtual_interface_redundancy:aws.directconnect.connection.ike_phase_encryption_strong(0.3); aws.directconnect.connection_redundancy:aws.directconnect.connection.ike_phase_encryption_strong(0.1); aws.directconnect.connection.ike_phase_encryption_strong(0.0); aws.directconnect.connection.tunnel_health_monitoring_enabled(0.0); aws.directconnect.connection.pre_shared_keys_rotation_policy_defined(0.0)
aws.docdb.cluster.audit_logging_enabled,docdb,cluster,logging_monitoring_and_alerting,medium,docdb.cluster.logging,logging_monitoring.logging.docdb_cluster_audit_logging_enabled,none,"None of the candidate rules address audit logging for DocumentDB clusters, which is the specific control in the YAML config rule.",aws.docdb.cluster.iam_authentication_enabled(0.333); aws.docdb.cluster.encryption_in_transit_enabled(0.286); aws.docdb.cluster.backup_retention_period_configured(0.143); aws.docdb.cluster.engine_version_check(0.143); aws.docdb.cluster.monitoring_and_alerting_configured(0.143)
aws.docdb.cluster.audit_logging_to_cloudwatch_enabled,docdb,cluster,logging_monitoring_and_alerting,medium,docdb.cluster.logging,logging_monitoring.logging.docdb_cluster_audit_logging_to_cloudwatch_enabled,none,"None of the candidate rules address audit logging to CloudWatch for DocumentDB clusters, focusing instead on IAM authentication, encryption, backups, engine versions, monitoring, or VPC security.",aws.docdb.cluster.iam_authentication_enabled(0.25); aws.docdb.cluster.encryption_in_transit_enabled(0.222); aws.docdb.cluster.backup_retention_period_configured(0.111); aws.docdb.cluster.engine_version_check(0.111); aws.docdb.cluster.monitoring_and_alerting_configured(0.111)
aws.docdb.cluster.deletion_protection_enabled,docdb,cluster,configuration_and_change_management,medium,docdb.cluster.configuration,security.configuration.docdb_cluster_deletion_protection_enabled,none,None of the candidate rules address deletion protection for DocumentDB clusters; they cover different security and operational aspects.,aws.docdb.cluster.iam_authentication_enabled(0.333); aws.docdb.cluster.encryption_in_transit_enabled(0.286); aws.docdb.cluster.backup_retention_period_configured(0.143); aws.docdb.cluster.engine_version_check(0.143); aws.docdb.cluster.monitoring_and_alerting_configured(0.143)
aws.docdb.cluster.docdb_multi_az_enabled,docdb,cluster,configuration_and_change_management,medium,docdb.cluster.configuration,security.configuration.docdb_cluster_docdb_multi_az_enabled,none,None of the candidate rules address multi-AZ availability configuration for DocumentDB clusters.,aws.docdb.cluster.iam_authentication_enabled(0.286); aws.docdb.cluster.encryption_in_transit_enabled(0.25); aws.docdb.cluster.backup_retention_period_configured(0.125); aws.docdb.cluster.engine_version_check(0.125); aws.docdb.cluster.monitoring_and_alerting_configured(0.125)
aws.docdb.cluster.docdb_storage_encrypted,docdb,cluster,data_protection_and_privacy,high,docdb.cluster.encryption,data_protection.encryption_rest.docdb_cluster_docdb_storage_encrypted,none,"The config rule checks for storage encryption at rest, but none of the candidates address encryption at rest for DocumentDB clusters.",aws.docdb.cluster.encryption_in_transit_enabled(0.286); aws.docdb.cluster.backup_retention_period_configured(0.143); aws.docdb.cluster.engine_version_check(0.143); aws.docdb.cluster.iam_authentication_enabled(0.143); aws.docdb.cluster.monitoring_and_alerting_configured(0.143)
aws.docdb.cluster.encryption_at_rest_cmek_configured,docdb,cluster,data_protection_and_privacy,high,docdb.cluster.encryption,data_protection.encryption_rest.docdb_cluster_encryption_at_rest_cmek_configured,none,No candidate rule addresses encryption at rest with customer-managed keys (CMEK) for DocumentDB clusters.,aws.docdb.cluster.encryption_in_transit_enabled(0.25); aws.docdb.cluster.backup_retention_period_configured(0.125); aws.docdb.cluster.engine_version_check(0.125); aws.docdb.cluster.iam_authentication_enabled(0.125); aws.docdb.cluster.monitoring_and_alerting_configured(0.125)
aws.docdb.cluster.encryption_at_rest_enabled,docdb,cluster,data_protection_and_privacy,high,docdb.cluster.encryption,data_protection.encryption_rest.docdb_cluster_encryption_at_rest_enabled,none,"The config rule checks encryption at rest for DocumentDB clusters, but all candidates cover different controls like encryption in transit, IAM authentication, backup, monitoring, or VPC security.",aws.docdb.cluster.encryption_in_transit_enabled(0.429); aws.docdb.cluster.iam_authentication_enabled(0.286); aws.docdb.cluster.backup_retention_period_configured(0.125); aws.docdb.cluster.engine_version_check(0.125); aws.docdb.cluster.monitoring_and_alerting_configured(0.125)
aws.docdb.cluster.preferred_backup_window_configured,docdb,cluster,resilience_and_disaster_recovery,medium,docdb.cluster.backup_recovery,resilience.backup_recovery.docdb_cluster_preferred_backup_window_configured,none,"None of the candidate rules address backup window configuration, which is a distinct control from backup retention period or other listed aspects.",aws.docdb.cluster.backup_retention_period_configured(0.333); aws.docdb.cluster.engine_version_check(0.143); aws.docdb.cluster.iam_authentication_enabled(0.143); aws.docdb.cluster.monitoring_and_alerting_configured(0.143); aws.docdb.cluster.encryption_in_transit_enabled(0.125)
aws.docdb.cluster.private_networking_enforced,docdb,cluster,network_security_and_connectivity,high,docdb.cluster.network,network_security.network_access.docdb_cluster_private_networking_enforced,none,"None of the candidate rules address private networking enforcement for DocumentDB clusters, which is the specific control in the YAML rule.",aws.docdb.cluster.backup_retention_period_configured(0.143); aws.docdb.cluster.engine_version_check(0.143); aws.docdb.cluster.iam_authentication_enabled(0.143); aws.docdb.cluster.monitoring_and_alerting_configured(0.143); aws.docdb.cluster.encryption_in_transit_enabled(0.125)
aws.docdb.cluster.public_access_disabled,docdb,cluster,network_security_and_connectivity,high,docdb.cluster.network,network_security.network_access.docdb_cluster_public_access_disabled,none,"None of the candidate rules address public access control for DocumentDB clusters, which is the specific network security focus of the given rule.",aws.docdb.cluster.backup_retention_period_configured(0.143); aws.docdb.cluster.engine_version_check(0.143); aws.docdb.cluster.iam_authentication_enabled(0.143); aws.docdb.cluster.monitoring_and_alerting_configured(0.143); aws.docdb.cluster.encryption_in_transit_enabled(0.125)
aws.docdb.instance.deletion_protection_enabled,docdb,instance,configuration_and_change_management,medium,docdb.instance.configuration,security.configuration.docdb_instance_deletion_protection_enabled,none,No candidate rule addresses deletion protection for DocumentDB instances or clusters.,aws.docdb.cluster.iam_authentication_enabled(0.143); aws.docdb.cluster.encryption_in_transit_enabled(0.125); aws.docdb.cluster.backup_retention_period_configured(0.0); aws.docdb.cluster.engine_version_check(0.0); aws.docdb.cluster.monitoring_and_alerting_configured(0.0)
aws.docdb.instance.encryption_at_rest_enabled,docdb,instance,data_protection_and_privacy,high,docdb.instance.encryption,data_protection.encryption_rest.docdb_instance_encryption_at_rest_enabled,none,"The config rule checks encryption at rest for DocumentDB instances, but all candidates focus on different controls like encryption in transit, IAM authentication, backups, or monitoring.",aws.docdb.cluster.encryption_in_transit_enabled(0.25); aws.docdb.cluster.iam_authentication_enabled(0.125); aws.docdb.cluster.backup_retention_period_configured(0.0); aws.docdb.cluster.engine_version_check(0.0); aws.docdb.cluster.monitoring_and_alerting_configured(0.0)
aws.dynamodb.resource.dynamodb_autoscaling_enabled,dynamodb,resource,configuration_and_change_management,medium,dynamodb.resource.configuration,security.configuration.dynamodb_resource_dynamodb_autoscaling_enabled,none,"The config rule checks for DynamoDB autoscaling enabled, but all candidate rules focus on encryption, backup, PITR, or other unrelated controls.",aws.dynamodb.autoscaling_enabled:aws.dynamodb.stream.encryption_at_rest_enabled(0.375); aws.dynamodb.encryption_enabled:aws.dynamodb.stream.encryption_at_rest_enabled(0.25); aws.dynamodb.pitr_enabled:aws.dynamodb.global_table.pitr_enabled_where_supported(0.222); aws.dynamodb.cluster.encryption_enabled:aws.dynamodb.stream.encryption_at_rest_enabled(0.222); aws.dynamodb.backup_enabled:aws.dynamodb.stream.encryption_at_rest_enabled(0.222)
aws.dynamodb.table_protected_by_backup_plan.table_protected_by_backup_plan_configured,dynamodb,table_protected_by_backup_plan,resilience_and_disaster_recovery,medium,dynamodb.table_protected_by_backup_plan.backup_recovery,resilience.backup_recovery.dynamodb_table_protected_by_backup_plan_table_protected_by_backup_plan_configured,none,"No candidate rule addresses DynamoDB table backup plan protection, focusing instead on unrelated controls like encryption, PITR, RBAC, or network isolation.",aws.dynamodb.table_protected_by_backup_plan:aws.dynamodb.table.rbac_least_privilege(0.4); dynamodb.tables.pitr.enabled(0.143); aws.dynamodb.table.rbac_least_privilege(0.125); dynamodb.tables.kms.cmk.encryption.enabled(0.111); aws.dynamodb.table.private_network_only_where_supported(0.1)
aws.ebs.volume.backup_configured,ebs,volume,resilience_and_disaster_recovery,medium,ebs.volume.backup_recovery,resilience.backup_recovery.ebs_volume_backup_configured,none,"The config rule checks for EBS volume backup configuration, but all candidate rules focus on encryption, key management, or snapshot privacy rather than backup configuration.",aws.ebs.volume.backup_configured:aws.ebs.volume.cmk_cmek_configured(0.333); aws.ebs.volume.cmk_cmek_configured(0.25); aws.ebs.volume.snapshots_encrypted(0.25); aws.ebs.volume.snapshots_not_public(0.2); aws.ebs.volume.encryption_at_rest_enabled(0.167)
