yaml_rule_id,yaml_service,yaml_resource_kind,domain,severity,scope,assertion_id,ai_confidence,ai_reasoning,top_candidate_pool
aws.eks.api.seccomp_profile_runtime_default_configured,eks,api,configuration_and_change_management,medium,eks.api.configuration,security.configuration.eks_api_seccomp_profile_runtime_default_configured,none,"The config rule checks for seccomp profile configuration on EKS API, but all candidate rules focus on different security controls like logging, networking, or authentication without addressing seccomp profiles.",aws.eks.fargate_profile.protect_kernel_defaults_enabled(0.222); aws.eks.fargate_profile.logging_enabled(0.125); aws.eks.fargate_profile.private_subnets_only(0.111); aws.eks.fargate_profile.anonymous_auth_disabled(0.111); aws.eks.cluster.default_service_account_automount_disabled(0.1)
aws.eks.api.type_loadbalancer_internal_only_where_required,eks,api,configuration_and_change_management,medium,eks.api.configuration,security.configuration.eks_api_type_loadbalancer_internal_only_where_required,none,"The config rule checks for internal load balancer usage in EKS API configurations, but no candidate rules address load balancer types or network access controls for EKS services.",aws.eks.fargate_profile.private_subnets_only(0.091); aws.eks.node_group.read_only_port_disabled(0.083); aws.eks.fargate_profile.read_only_port_disabled(0.083); aws.eks.node_kubelet_read_only_port_check:aws.eks.node_group.read_only_port_disabled(0.067); aws.eks.control_plane_logging_all_types_enabled:aws.eks.cluster.private_control_plane_endpoint_enabled(0.059)
aws.eks.certificate.monitored,eks,certificate,logging_monitoring_and_alerting,medium,eks.certificate.logging,logging_monitoring.monitoring.eks_certificate_monitored,none,"No candidate rule addresses monitoring of EKS certificates, which is the specific control in the YAML rule.",aws.eks.certificate.check:aws.eks.cluster.client_cert_auth_enabled(0.111); aws.eks.cluster.audit_logging_enabled(0.0); aws.eks.cluster.private_control_plane_endpoint_enabled(0.0); aws.eks.cluster.default_service_account_automount_disabled(0.0); aws.eks.node_group.nodes_no_public_ip(0.0)
aws.elasticache.backupretention.backup_retention_configured,elasticache,backupretention,resilience_and_disaster_recovery,medium,elasticache.backupretention.backup_recovery,resilience.backup_recovery.elasticache_backupretention_backup_retention_configured,none,"None of the candidate rules address backup retention configuration for ElastiCache, which is the specific control in the YAML rule.",aws.elasticache.backup_retention:aws.elasticache.cluster.audit_logging_enabled(0.111); aws.elasticache.cluster.encryption_at_rest_cmek(0.0); aws.elasticache.cluster.private_networking_enforced(0.0); aws.elasticache.cluster.deletion_protection_enabled(0.0); aws.elasticache.cluster.audit_logging_enabled(0.0)
aws.elasticbeanstalk.application_version.elasticbeanstalk_immutability_enabled,elasticbeanstalk,application_version,configuration_and_change_management,medium,elasticbeanstalk.application_version.configuration,security.configuration.elasticbeanstalk_application_version_elasticbeanstalk_immutability_enabled,none,"The config rule checks for Elastic Beanstalk application version immutability, while all candidates focus on managed updates or CloudWatch logging, which are unrelated controls.",aws.elasticbeanstalk.managed_updates_enabled(0.143); aws.elasticbeanstalk.environment_cloudwatch_logging_enabled(0.125); aws.elasticbeanstalk.environment_cloudwatch_logging_enabled:nan(0.0); aws.elasticbeanstalk.managed_updates_enabled:nan(0.0)
aws.elasticbeanstalk.environment.env_secrets_from_vault_only_configured,elasticbeanstalk,environment,configuration_and_change_management,medium,elasticbeanstalk.environment.configuration,security.configuration.elasticbeanstalk_environment_env_secrets_from_vault_only_configured,none,"The config rule focuses on secrets management from a vault, while all candidates are about logging or managed updates, with no semantic overlap.",aws.elasticbeanstalk.environment_cloudwatch_logging_enabled(0.111); aws.elasticbeanstalk.environment_cloudwatch_logging_enabled:nan(0.111); aws.elasticbeanstalk.managed_updates_enabled(0.0); aws.elasticbeanstalk.managed_updates_enabled:nan(0.0)
aws.elasticbeanstalk.environment.private_networking_enforced,elasticbeanstalk,environment,network_security_and_connectivity,high,elasticbeanstalk.environment.network,network_security.network_access.elasticbeanstalk_environment_private_networking_enforced,none,None of the candidate rules address network security or private networking for Elastic Beanstalk environments.,aws.elasticbeanstalk.environment_cloudwatch_logging_enabled(0.143); aws.elasticbeanstalk.environment_cloudwatch_logging_enabled:nan(0.143); aws.elasticbeanstalk.managed_updates_enabled(0.0); aws.elasticbeanstalk.managed_updates_enabled:nan(0.0)
aws.elasticbeanstalk.environment.tls_min_1_2_enforced,elasticbeanstalk,environment,data_protection_and_privacy,high,elasticbeanstalk.environment.encryption,data_protection.encryption_transit.elasticbeanstalk_environment_tls_min_1_2_enforced,none,"The config rule enforces TLS 1.2+ for Elastic Beanstalk environments, but all candidates only cover CloudWatch logging or managed updates, which are unrelated to TLS encryption.",aws.elasticbeanstalk.environment_cloudwatch_logging_enabled(0.111); aws.elasticbeanstalk.environment_cloudwatch_logging_enabled:nan(0.111); aws.elasticbeanstalk.managed_updates_enabled(0.0); aws.elasticbeanstalk.managed_updates_enabled:nan(0.0)
aws.elb.internetfacing.elb_internet_facing_configured,elb,internetfacing,configuration_and_change_management,medium,elb.internetfacing.configuration,security.configuration.elb_internetfacing_elb_internet_facing_configured,none,"No candidate rule addresses internet-facing ELB configuration, which is the specific control being asserted.",aws.elb.internet_facing:aws.elb.load_balancer.waf_attached_where_supported(0.182); aws.elb.ssl_listeners:aws.elb.load_balancer.secure_listener_protocols(0.091); aws.elbv2.internet_facing:aws.elbv2.target_group.targets_in_private_subnets(0.091); aws.elb.is_in_multiple_az:aws.elb.load_balancer.waf_attached_where_supported(0.071); aws.elb.insecure_ssl_ciphers:aws.elb.load_balancer.listener_tls_min_1_2(0.071)
aws.elb.isinmultipleaz.elb_is_in_multiple_az_configured,elb,isinmultipleaz,configuration_and_change_management,medium,elb.isinmultipleaz.configuration,security.configuration.elb_isinmultipleaz_elb_is_in_multiple_az_configured,none,"No candidate rule addresses ELB multi-AZ configuration, which is the specific control being asserted.",aws.elb.is_in_multiple_az:aws.elb.load_balancer.waf_attached_where_supported(0.308); aws.elbv2.is_in_multiple_az:aws.elbv2.target_group.targets_in_private_subnets(0.25); aws.elbv2.target_group.targets_in_private_subnets(0.1); aws.elb.ssl_listeners:aws.elb.load_balancer.secure_listener_protocols(0.077); aws.elbv2.internet_facing:aws.elbv2.target_group.targets_in_private_subnets(0.077)
aws.elbv2.alb_https_redirect.elbv2_alb_https_redirect_configured,elbv2,alb_https_redirect,configuration_and_change_management,medium,elbv2.alb_https_redirect.configuration,security.configuration.elbv2_alb_https_redirect_elbv2_alb_https_redirect_configured,none,"The config rule checks for HTTPS redirect configuration on ALBs, but none of the candidate rules address redirect functionality or HTTP-to-HTTPS enforcement.",aws.elbv2.alb_https_redirect:aws.elbv2.target_group.targets_in_private_subnets(0.3); aws.elbv2.deletion_protection:aws.elbv2.load_balancer.deletion_protection_enabled(0.1); aws.elbv2.internet_facing:aws.elbv2.target_group.targets_in_private_subnets(0.091); aws.elbv2.waf_acl_attached:aws.elbv2.load_balancer.waf_attached_where_supported(0.083); aws.elbv2.insecure_ssl_ciphers:aws.elbv2.listener.tls_min_1_2(0.083)
aws.elbv2.internetfacing.elbv2_internet_facing_configured,elbv2,internetfacing,configuration_and_change_management,medium,elbv2.internetfacing.configuration,security.configuration.elbv2_internetfacing_elbv2_internet_facing_configured,none,"None of the candidate rules address internet-facing configuration of ELBv2 load balancers, which is the specific control being asserted.",aws.elbv2.internet_facing:aws.elbv2.target_group.targets_in_private_subnets(0.2); aws.elbv2.deletion_protection:aws.elbv2.load_balancer.deletion_protection_enabled(0.1); aws.elbv2.waf_acl_attached:aws.elbv2.load_balancer.waf_attached_where_supported(0.083); aws.elbv2.insecure_ssl_ciphers:aws.elbv2.listener.tls_min_1_2(0.083); aws.elbv2.is_in_multiple_az:aws.elbv2.target_group.targets_in_private_subnets(0.083)
aws.elbv2.isinmultipleaz.elbv2_is_in_multiple_az_configured,elbv2,isinmultipleaz,configuration_and_change_management,medium,elbv2.isinmultipleaz.configuration,security.configuration.elbv2_isinmultipleaz_elbv2_is_in_multiple_az_configured,none,None of the candidate rules address the specific control of ensuring ELBv2 load balancers are deployed across multiple availability zones.,aws.elbv2.is_in_multiple_az:aws.elbv2.target_group.targets_in_private_subnets(0.364); aws.elb.is_in_multiple_az:aws.elb.load_balancer.waf_attached_where_supported(0.214); aws.elbv2.internet_facing:aws.elbv2.target_group.targets_in_private_subnets(0.167); aws.elbv2.alb_https_redirect:aws.elbv2.target_group.targets_in_private_subnets(0.154); aws.elbv2.target_group.targets_in_private_subnets(0.1)
aws.glue.data_catalogs_not_publicly_accessible.data_catalogs_not_publicly_accessible_configured,glue,data_catalogs_not_publicly_accessible,logging_monitoring_and_alerting,medium,glue.data_catalogs_not_publicly_accessible.logging,logging_monitoring.logging.glue_data_catalogs_not_publicly_accessible_data_catalogs_not_publicly_accessible_configured,none,"The config rule checks for public accessibility of Glue Data Catalogs, while all candidates focus on encryption, logging, RBAC, or data lineage without addressing public access restrictions.",aws.glue.data_catalogs_not_publicly_accessible:aws.glue.data_quality_ruleset.run_metadata_logging_enabled(0.308); aws.glue.partition.catalog_encrypted(0.143); aws.glue.catalog.store_encrypted(0.143); aws.glue.data_catalogs_metadata_encryption_enabled:aws.glue.data_quality_ruleset.run_metadata_logging_enabled(0.143); aws.glue.catalog.metadata_encryption_enabled(0.125)
aws.glue.devendpoint.encryption_at_rest_enabled,glue,devendpoint,data_protection_and_privacy,high,glue.devendpoint.encryption,data_protection.encryption_rest.glue_devendpoint_encryption_at_rest_enabled,none,"No candidate rule specifically addresses encryption at rest for Glue development endpoints, which is the exact technical control in the config rule.",aws.glue.table.s3_encrypted_at_rest(0.429); aws.glue.data_quality_ruleset.encrypted_at_rest(0.375); aws.glue.catalog.metadata_encryption_enabled(0.286); aws.glue.database.metadata_encryption_enabled(0.286); aws.glue.workflow.kms_encryption_enabled(0.286)
aws.guardduty.centrally_managed.guardduty_centrally_managed_configured,guardduty,centrally_managed,configuration_and_change_management,medium,guardduty.centrally_managed.configuration,security.configuration.guardduty_centrally_managed_guardduty_centrally_managed_configured,none,"The config rule checks for centrally managed GuardDuty configuration, but all candidates focus on different aspects like detectors, findings, IP sets, or custom identifiers without addressing central management.",aws.guardduty.centrally_managed:aws.guardduty.custom_identifier.source_trusted(0.25); aws.guardduty.security_center_enabled:aws.guardduty.detector.detectors_enabled(0.125); aws.guardduty.enabled:aws.guardduty.detector.enabled_in_all_regions(0.111); aws.guardduty.no_high_severity_findings:aws.guardduty.custom_identifier.source_trusted(0.091); aws.guardduty.finding.reports_storage_encrypted(0.0)
aws.iam.access_analyzer_active_status_all_regions.access_analyzer_active_status_all_regions_configured,iam,access_analyzer_active_status_all_regions,configuration_and_change_management,medium,iam.access_analyzer_active_status_all_regions.configuration,security.configuration.iam_access_analyzer_active_status_all_regions_access_analyzer_active_status_all_regions_configured,none,"The config rule checks for IAM Access Analyzer active status across all regions, but none of the candidate rules address Access Analyzer configuration or monitoring.",aws.iam.access_analyzer_active_status_all_regions:aws.iam.instance_profile.role_policies_least_privilege(0.357); aws.iam.access_analyzer_external_access_enabled_all_regions:aws.iam.instance_profile.role_policies_least_privilege(0.188); aws.iam.user.single_active_access_key_audit:aws.iam.user.access_keys_rotated_90_days_or_less_when_present(0.111); aws.iam.user.single_active_access_key_check:aws.iam.user.access_keys_rotated_90_days_or_less_when_present(0.111); iam.user.console.access.unused(0.111)
aws.iam.avoidrootusage.avoid_root_usage_configured,iam,avoidrootusage,configuration_and_change_management,medium,iam.avoidrootusage.configuration,security.configuration.iam_avoidrootusage_avoid_root_usage_configured,none,"The config rule focuses on avoiding root usage configuration, while all candidates address different controls like MFA, access keys, or policy management.",aws.iam.avoid_root_usage:aws.iam.instance_profile.role_policies_least_privilege(0.167); iam.root.mfa.enabled(0.167); iam.no.root.access.key(0.143); iam.root.hardware.mfa.enabled(0.143); aws.iam.root_mfa_enabled:aws.iam.instance_profile.role_policies_least_privilege(0.077)
aws.iam.key.monitored,iam,key,logging_monitoring_and_alerting,medium,iam.key.logging,logging_monitoring.monitoring.iam_key_monitored,none,"The config rule focuses on monitoring IAM keys for logging, while all candidates address key rotation, usage, or other security aspects without covering monitoring.",iam.no.root.access.key(0.2); iam.rotate.access.key.90.days(0.167); aws.iam.role.no_user_managed_long_lived_keys(0.125); aws.iam.role.keys_not_used_or_rotated_90_days_or_less(0.1); aws.iam.key.:aws.iam.instance_profile.role_policies_least_privilege(0.1)
aws.iam.no_guest_accounts_with_permissions.no_guest_accounts_with_permissions_configured,iam,no_guest_accounts_with_permissions,identity_and_access_management,high,iam.no_guest_accounts_with_permissions.access_control,identity_access.least_privilege.iam_no_guest_accounts_with_permissions_no_guest_accounts_with_permissions_configured,none,"No candidate rule addresses guest accounts or permissions for guest accounts, which is the specific control focus of the YAML rule.",aws.iam.no_guest_accounts_with_permissions:aws.iam.instance_profile.no_instance_profile_with_admin_star(0.364); aws.iam.instance_profile.no_instance_profile_with_admin_star(0.222); aws.iam.group.no_inline_policies(0.125); aws.iam.role.no_inline_policies(0.125); iam.no.root.access.key(0.125)
aws.iam.policy.monitored,iam,policy,logging_monitoring_and_alerting,medium,iam.policy.logging,logging_monitoring.monitoring.iam_policy_monitored,none,"The config rule focuses on monitoring/logging of IAM policies, while all candidates address policy content constraints, password policies, or inline policies, with no coverage of monitoring or logging aspects.",aws.iam.policy.resource_constraints_present(0.25); iam.password.policy.lowercase(0.25); iam.password.policy.symbol(0.25); iam.password.policy.uppercase(0.25); iam.password.policy.number(0.25)
aws.iam.policy.policy_enabled,iam,policy,identity_and_access_management,high,iam.policy.access_control,identity_access.least_privilege.iam_policy_policy_enabled,none,"No candidate rule addresses the specific control of ensuring IAM policies are enabled, as all candidates focus on versioning, constraints, password policies, or other unrelated aspects.",aws.iam.policy.versioning_and_change_audit_enabled(0.333); aws.iam.managed_policy.versioning_and_change_audit_enabled(0.286); aws.iam.policy.resource_constraints_present(0.25); iam.password.policy.lowercase(0.25); iam.password.policy.symbol(0.25)
aws.iam.role.creation_monitored,iam,role,logging_monitoring_and_alerting,medium,iam.role.logging,logging_monitoring.monitoring.iam_role_creation_monitored,none,"The config rule focuses on monitoring IAM role creation, but none of the candidate rules address logging or monitoring aspects.",iam.support.role.created(0.2); aws.iam.role.no_inline_policies(0.167); aws.iam.instance_profile.role_attached(0.167); aws.iam.role.trust_principals_allowlist_only(0.143); aws.iam.role.max_session_duration_reasonable(0.143)
aws.iam.user.centralization_monitored,iam,user,logging_monitoring_and_alerting,medium,iam.user.logging,logging_monitoring.monitoring.iam_user_centralization_monitored,none,"The config rule focuses on monitoring IAM user centralization, but all candidates address unrelated controls like MFA, access keys, or inactivity.",aws.iam.user.mfa_required(0.2); iam.user.accesskey.unused(0.2); iam.user.console.access.unused(0.167); aws.iam.user.no_inline_policies_attached(0.143); aws.iam.user.inactive_90_days_disabled(0.143)
aws.iam.user.policy_elastic_disaster_recovery_configured,iam,user,identity_and_access_management,high,iam.user.access_control,identity_access.least_privilege.iam_user_policy_elastic_disaster_recovery_configured,none,"No candidate rule addresses Elastic Disaster Recovery configuration for IAM users, as all candidates focus on unrelated controls like access keys, inline policies, MFA, or password policies.",aws.iam.user.policy_elastic_disaster_recovery_check:aws.iam.user.access_keys_rotated_90_days_or_less_when_present(0.312); aws.iam.user.no_inline_policies_attached(0.25); aws.iam.user.no_inline_policies:aws.iam.group.no_inline_policies(0.2); aws.iam.user.mfa_required(0.143); aws.iam.policy.resource_constraints_present(0.143)
aws.iam.user.single_active_access_key_configured,iam,user,configuration_and_change_management,medium,iam.user.configuration,security.configuration.iam_user_single_active_access_key_configured,none,"The config rule checks for a single active access key per IAM user, but all candidates focus on rotation, unused keys, MFA, or other unrelated controls.",aws.iam.user.single_active_access_key_audit:aws.iam.user.access_keys_rotated_90_days_or_less_when_present(0.357); aws.iam.user.single_active_access_key_check:aws.iam.user.access_keys_rotated_90_days_or_less_when_present(0.357); iam.user.console.access.unused(0.286); iam.no.root.access.key(0.286); aws.iam.user.access_keys_rotated_90_days_or_less_when_present(0.25)
aws.identitystore.group.admin_group_limited,identitystore,group,identity_and_access_management,medium,identitystore.group.membership,iam.access_control.identitystore_group_admin_group_limited,none,"No candidate rule addresses limiting admin groups in AWS Identity Store membership, which is the specific control for the given config rule.",aws.autoscaling.group.configured(0.333); aws.athena.work_group.admin_activity_logging_enabled(0.286); aws.iam.group.attached_policies_not_admin_star(0.286); aws.identity_center.group.attached_policies_not_admin_star(0.286); aws.iam.group.attached_policies_not_admin_star(0.286)
aws.inspector.resource.inspector_is_enabled,inspector,resource,configuration_and_change_management,medium,inspector.resource.configuration,security.configuration.inspector_resource_inspector_is_enabled,none,"The config rule checks if AWS Inspector is enabled, but all candidate rules focus on specific aspects like encryption, alerting, or assessment scope rather than the basic enablement status.",aws.inspector.is_enabled:aws.inspector.assessment.policy_store_encrypted(0.25); aws.inspector.finding.alert_destinations_configured(0.0); aws.inspector.finding.archival_export_encrypted(0.0); aws.inspector.finding.suppression_rules_documented_and_scoped(0.0); aws.inspector.assessment.agents_or_scanners_deployed(0.0)
aws.inspector2.finding.critical_finding_not_open,inspector2,finding,configuration_and_change_management,critical,inspector2.finding.vulnerability,configuration.inspector2_finding_critical_not_open,none,"The config rule checks for critical Inspector2 vulnerability findings not being open, while all candidates address unrelated controls like public snapshots, alert destinations, or certificate expiration.",aws.ebs.snapshot.snapshots_not_public(0.167); aws.ebs.snapshot.not_public(0.167); aws.ec2.snapshot.not_public(0.167); aws.rds.snapshot.not_public(0.167); aws.cloudwatch.alarm.critical_alarms_enabled(0.167)
aws.inspector2.organization.scanning_enabled,inspector2,organization,configuration_and_change_management,medium,inspector2.organization.configuration,configuration.inspector2_organization_scanning_enabled,none,"No candidate rule addresses Inspector2 organization-level scanning configuration, which is a specific AWS service control distinct from other scanning or enabling rules.",aws.organizations.organization.scps_enabled(0.5); aws.ecr.repository.image_scanning_enabled(0.4); aws.accessanalyzer.enabled(0.333); securityhub.enabled(0.333); aws.config.configuration_recorder.enabled(0.25)
aws.kinesis.stream_data_retention_period.stream_data_retention_period_configured,kinesis,stream_data_retention_period,data_protection_and_privacy,low,kinesis.stream_data_retention_period.data_protection,data_protection.data_lifecycle.kinesis_stream_data_retention_period_stream_data_retention_period_configured,none,"The config rule checks for Kinesis stream data retention period configuration, but all candidate rules focus on different controls like authentication, encryption, or network privacy.",aws.kinesis.stream_data_retention_period:aws.kinesis.stream.consumer_auth_required(0.333); aws.kinesis.stream.consumer_auth_required(0.143); aws.kinesis.stream.encryption_at_rest_enabled(0.125); aws.kinesis.stream.private_network_only_where_supported(0.111); aws.kinesis.stream_encrypted_at_rest:aws.kinesis.stream.encryption_at_rest_enabled(0.1)
aws.kinesisfirehose.deliverystream.encryption_at_rest_enabled,kinesisfirehose,deliverystream,data_protection_and_privacy,high,kinesisfirehose.deliverystream.encryption,data_protection.encryption_rest.kinesisfirehose_deliverystream_encryption_at_rest_enabled,none,No candidate rule matches the Kinesis Firehose Delivery Stream service and resource type for encryption at rest.,efs.encryption.at.rest.enabled(0.8); aws.glacier.vault.encryption_at_rest_enabled(0.667); aws.s3.bucket.encryption_at_rest_enabled(0.667); aws.ebs.snapshot.encryption_at_rest_enabled(0.667); aws.ebs.volume.encryption_at_rest_enabled(0.667)
aws.kinesisfirehose.deliverystream.logging_enabled,kinesisfirehose,deliverystream,logging_monitoring_and_alerting,medium,kinesisfirehose.deliverystream.logging,logging_monitoring.logging.kinesisfirehose_deliverystream_logging_enabled,none,No candidate rules match the Kinesis Firehose Delivery Stream service and logging control.,aws.networkfirewall.logging_enabled(0.667); elb.logging.enabled(0.667); elbv2.logging.enabled(0.667); aws.glue.crawler.logs_enabled(0.5); aws.glue.trigger.logs_enabled(0.5)
aws.kms.key.lifecycle_policy_configured,kms,key,identity_and_access_management,high,kms.key.access_control,identity_access.least_privilege.kms_key_lifecycle_policy_configured,none,"The config rule checks for KMS key lifecycle policy configuration, but all candidate rules focus on different controls like key policies, rotation, logging, or accessibility.",aws.kms.key.lifecycle_policy:aws.kms.key.key_policy_least_privilege(0.429); aws.kms.key.key_policy_least_privilege(0.4); aws.kms.key.key_rotation_enabled(0.2); aws.kms.key.logging_enabled(0.2); aws.kms.alias.key_has_alias(0.2)
aws.lambda.function.not_publicly_accessible_configured,lambda,function,network_security_and_connectivity,high,lambda.function.network,network_security.network_access.lambda_function_not_publicly_accessible_configured,none,No candidate rule addresses Lambda function public accessibility or network access controls.,aws.lambda.function.outputs_encrypted(0.167); aws.lambda.function.jobs_private_networking(0.143); aws.lambda.function.role_least_privilege(0.143); aws.lambda.function.dead_letter_queue_configured(0.143); aws.lambda.function.execution_roles_least_privilege(0.125)
aws.lambda.function.reserved_concurrency_configured,lambda,function,configuration_and_change_management,medium,lambda.function.configuration,security.configuration.lambda_function_reserved_concurrency_configured,none,"No candidate rule addresses Lambda function reserved concurrency configuration, which is a specific performance/availability control unrelated to encryption, networking, logging, or least privilege.",aws.lambda.function.reserved_concurrency:aws.lambda.function.artifacts_encrypted_and_private(0.222); aws.lambda.function.outputs_encrypted(0.2); aws.lambda.function.jobs_private_networking(0.167); aws.lambda.function.role_least_privilege(0.167); aws.lambda.function.dead_letter_queue_configured(0.167)
aws.lambda.function.url_cors_policy_configured,lambda,function,identity_and_access_management,high,lambda.function.access_control,identity_access.least_privilege.lambda_function_url_cors_policy_configured,none,"No candidate rule addresses CORS policy configuration for Lambda function URLs, which is the specific technical control in the YAML rule.",aws.lambda.function.url_cors_policy:aws.lambda.function.artifacts_encrypted_and_private(0.3); aws.lambda.function.policies_present_for_sensitive_fields(0.25); aws.lambda.function.url_public:aws.lambda.function.artifacts_encrypted_and_private(0.2); aws.lambda.function.url_authentication:aws.lambda.function.artifacts_encrypted_and_private(0.2); aws.lambda.function.outputs_encrypted(0.167)
