yaml_rule_id,yaml_service,yaml_resource_kind,domain,severity,scope,assertion_id,ai_confidence,ai_reasoning,top_candidate_pool
aws.ec2.account.block_public_access_configured,ec2,account,network_security_and_connectivity,high,ec2.account.network,network_security.network_access.ec2_account_block_public_access_configured,none,"The config rule checks EC2 account-level block public access configuration, while all candidates focus on specific resource-level public access controls like instances, snapshots, or subnets.",aws.ec2.account.block_public_access:aws.ec2.subnet.public_subnets_use_nacl_restrictions(0.3); aws.ec2.snapshot.not_public(0.167); ec2.instance.public.ip(0.167); ec2.ebs.public.snapshot(0.167); aws.ec2.instance.no_public_ip_assigned(0.125)
aws.ec2.eip.not_in_use,ec2,eip,configuration_and_change_management,medium,ec2.eip.configuration,security.configuration.ec2_eip_not_in_use,none,"The config rule checks for unused Elastic IPs (EIPs), while all candidate rules focus on public access restrictions, encryption, launch templates, or other unrelated EC2 controls.",aws.ec2.snapshot.not_public(0.167); aws.ec2.ami.not_publicly_shared(0.143); aws.ec2.launch_template.uses_approved_launch_template(0.143); aws.ec2.subnet.public_subnets_use_nacl_restrictions(0.125); aws.ec2.ebs_public_snapshot:aws.ebs.snapshot.snapshots_not_public(0.125)
aws.ec2.eip.shodan_exposure_detected,ec2,eip,configuration_and_change_management,medium,ec2.eip.configuration,security.configuration.ec2_eip_shodan_exposure_detected,none,"The config rule detects EC2 EIP exposure via Shodan, while all candidates are about CloudWatch metric filters or API Gateway logging, which are unrelated to EC2 EIP security monitoring.",aws.cloudwatch.metric_filter.console_root_login_detected_filter_present(0.1); aws.cloudwatch.metric_filter.iam_policy_change_detected_filter_present(0.1); aws.cloudwatch.metric_filter.kms_key_deletion_or_disable_detected_filter_present(0.083); aws.cloudwatch.metric_filter.network_acl_or_sg_change_detected_filter_present(0.083); aws.api_gateway.stage.api_access_logging_enabled(0.0)
aws.ec2.instance.internet_facing_with_instance_profile_configured,ec2,instance,configuration_and_change_management,medium,ec2.instance.configuration,security.configuration.ec2_instance_internet_facing_with_instance_profile_configured,none,No candidate rule addresses the specific combination of internet-facing EC2 instances with attached instance profiles.,aws.ec2.instance.internet_facing_with_instance_profile:aws.ec2.instance.data_volumes_encrypted_cmek(0.364); aws.ec2.spot_instance.instance_profile_least_privilege(0.25); aws.ec2.launch_template.instance_profile_least_privilege(0.222); aws.ec2.auto_scaling_group.instance_profile_least_privilege(0.2); aws.ec2.instance.profile_attached:aws.ec2.instance.data_volumes_encrypted_cmek(0.182)
aws.ec2.instance.paravirtual_type_configured,ec2,instance,configuration_and_change_management,medium,ec2.instance.configuration,security.configuration.ec2_instance_paravirtual_type_configured,none,No candidate rule addresses paravirtual type configuration for EC2 instances.,aws.ec2.instance.paravirtual_type:aws.ec2.instance.data_volumes_encrypted_cmek(0.222); aws.ec2.instance.imds_hardened(0.2); aws.ec2.instance.vtpm_enabled(0.2); ec2.instance.public.ip(0.2); aws.ec2.instance.secure_boot_enabled(0.167)
aws.ec2.instance.patch_compliance_status_check,ec2,instance,compliance_and_governance,medium,ec2.instance.compliance,compliance.policy_enforcement.ec2_instance_patch_compliance_status_check,none,"None of the candidate rules address patch compliance for EC2 instances, which is the specific control in the YAML config rule.",aws.ec2.patch_compliance:aws.ec2.instance.security_group_inbound_restricted(0.182); aws.ec2.instance.iam_role_compliance_check:aws.ec2.instance.data_volumes_encrypted_cmek(0.154); aws.ec2.instance.imds_hardened(0.143); aws.ec2.instance.vtpm_enabled(0.143); ec2.instance.public.ip(0.143)
aws.ec2.instance.port_kafka_exposed_to_internet_configured,ec2,instance,configuration_and_change_management,medium,ec2.instance.configuration,security.configuration.ec2_instance_port_kafka_exposed_to_internet_configured,none,"The config rule checks for Kafka ports exposed to internet, but all candidate rules are about data volume encryption with CMEK, which is completely unrelated to port exposure controls.",aws.ec2.instance.port_kafka_exposed_to_internet:aws.ec2.instance.data_volumes_encrypted_cmek(0.417); aws.ec2.instance.port_oracle_exposed_to_internet:aws.ec2.instance.data_volumes_encrypted_cmek(0.308); aws.ec2.instance.port_cassandra_exposed_to_internet:aws.ec2.instance.data_volumes_encrypted_cmek(0.308); aws.ec2.instance.port_cifs_exposed_to_internet:aws.ec2.instance.data_volumes_encrypted_cmek(0.308); aws.ec2.instance.port_rdp_exposed_to_internet:aws.ec2.instance.data_volumes_encrypted_cmek(0.308)
aws.ec2.instance.port_ldap_exposed_to_internet_configured,ec2,instance,configuration_and_change_management,medium,ec2.instance.configuration,security.configuration.ec2_instance_port_ldap_exposed_to_internet_configured,none,None of the candidate rules address LDAP port exposure; they all reference data volume encryption instead.,aws.ec2.instance.port_ldap_exposed_to_internet:aws.ec2.instance.data_volumes_encrypted_cmek(0.417); aws.ec2.instance.port_oracle_exposed_to_internet:aws.ec2.instance.data_volumes_encrypted_cmek(0.308); aws.ec2.instance.port_kafka_exposed_to_internet:aws.ec2.instance.data_volumes_encrypted_cmek(0.308); aws.ec2.instance.port_cassandra_exposed_to_internet:aws.ec2.instance.data_volumes_encrypted_cmek(0.308); aws.ec2.instance.port_cifs_exposed_to_internet:aws.ec2.instance.data_volumes_encrypted_cmek(0.308)
aws.ec2.instance.port_mysql_exposed_to_internet_configured,ec2,instance,configuration_and_change_management,medium,ec2.instance.configuration,security.configuration.ec2_instance_port_mysql_exposed_to_internet_configured,none,None of the candidate rules address MySQL port exposure; they all reference data volume encryption instead.,aws.ec2.instance.port_mysql_exposed_to_internet:aws.ec2.instance.data_volumes_encrypted_cmek(0.417); aws.ec2.instance.port_oracle_exposed_to_internet:aws.ec2.instance.data_volumes_encrypted_cmek(0.308); aws.ec2.instance.port_kafka_exposed_to_internet:aws.ec2.instance.data_volumes_encrypted_cmek(0.308); aws.ec2.instance.port_cassandra_exposed_to_internet:aws.ec2.instance.data_volumes_encrypted_cmek(0.308); aws.ec2.instance.port_cifs_exposed_to_internet:aws.ec2.instance.data_volumes_encrypted_cmek(0.308)
aws.ec2.instance.port_oracle_exposed_to_internet_configured,ec2,instance,configuration_and_change_management,medium,ec2.instance.configuration,security.configuration.ec2_instance_port_oracle_exposed_to_internet_configured,none,"The YAML rule checks for Oracle ports exposed to internet, but all candidate rules are about data volume encryption with CMEK, which is completely unrelated to port exposure controls.",aws.ec2.instance.port_oracle_exposed_to_internet:aws.ec2.instance.data_volumes_encrypted_cmek(0.417); aws.ec2.instance.port_kafka_exposed_to_internet:aws.ec2.instance.data_volumes_encrypted_cmek(0.308); aws.ec2.instance.port_cassandra_exposed_to_internet:aws.ec2.instance.data_volumes_encrypted_cmek(0.308); aws.ec2.instance.port_cifs_exposed_to_internet:aws.ec2.instance.data_volumes_encrypted_cmek(0.308); aws.ec2.instance.port_rdp_exposed_to_internet:aws.ec2.instance.data_volumes_encrypted_cmek(0.308)
aws.ec2.instance.port_rdp_exposed_to_internet_configured,ec2,instance,configuration_and_change_management,medium,ec2.instance.configuration,security.configuration.ec2_instance_port_rdp_exposed_to_internet_configured,none,None of the candidate rules address RDP port exposure to the internet; they all reference data volume encryption with CMEK instead.,aws.ec2.instance.port_rdp_exposed_to_internet:aws.ec2.instance.data_volumes_encrypted_cmek(0.417); aws.ec2.instance.port_oracle_exposed_to_internet:aws.ec2.instance.data_volumes_encrypted_cmek(0.308); aws.ec2.instance.port_kafka_exposed_to_internet:aws.ec2.instance.data_volumes_encrypted_cmek(0.308); aws.ec2.instance.port_cassandra_exposed_to_internet:aws.ec2.instance.data_volumes_encrypted_cmek(0.308); aws.ec2.instance.port_cifs_exposed_to_internet:aws.ec2.instance.data_volumes_encrypted_cmek(0.308)
aws.ec2.instance.stopped_instances_removed,ec2,instance,configuration_and_change_management,medium,ec2.instance.configuration,security.configuration.ec2_instance_stopped_instances_removed,none,"No candidate rule addresses the removal or management of stopped EC2 instances, which is the focus of the YAML rule.",aws.ec2.stopped_instance:aws.ec2.instance.security_group_inbound_restricted(0.222); aws.ec2.instance.imds_hardened(0.2); aws.ec2.instance.vtpm_enabled(0.2); ec2.instance.public.ip(0.2); aws.ec2.instance.secure_boot_enabled(0.167)
aws.ec2.instance.uses_single_eni_configured,ec2,instance,configuration_and_change_management,medium,ec2.instance.configuration,security.configuration.ec2_instance_uses_single_eni_configured,none,No candidate rule addresses EC2 instance network interface (ENI) configuration or single ENI usage.,aws.ec2.instance.uses_single_eni:aws.ec2.instance.data_volumes_encrypted_cmek(0.3); aws.ec2.spot_instance.uses_approved_launch_template(0.25); aws.ec2.instance.imds_hardened(0.167); aws.ec2.instance.vtpm_enabled(0.167); ec2.instance.public.ip(0.167)
aws.ec2.networkacl.unused_network_acl_configured,ec2,networkacl,network_security_and_connectivity,high,ec2.networkacl.network,network_security.network_access.ec2_networkacl_unused_network_acl_configured,none,"The config rule checks for unused network ACLs, but all candidate rules focus on ACL rule restrictions, endpoint policies, or unrelated resources like key pairs and subnets.",aws.ec2.network_acl.egress_restricted(0.333); aws.ec2.network_acl.endpoint_policies_applied(0.286); aws.ec2.networkacl_allow_ingress_any_port:aws.ec2.network_acl.no_unrestricted_ingress(0.273); aws.ec2.network_acl.no_allow_all_rules(0.25); aws.ec2.network_acl.identity_aware_policies_enabled(0.25)
aws.ec2.transitgateway.auto_cross_account_attachment_disabled,ec2,transitgateway,configuration_and_change_management,medium,ec2.transitgateway.configuration,security.configuration.ec2_transitgateway_auto_cross_account_attachment_disabled,none,"None of the candidate rules address Transit Gateway auto-accept cross-account attachment settings, which is a specific VPC networking control unrelated to the listed compute, security group, or encryption rules.",aws.ec2.transitgateway_auto_accept_vpc_attachments:aws.ec2.instance.security_group_inbound_restricted(0.133); aws.ec2.key_pair.disable_unused_keys(0.111); aws.ec2.instance.ssh_password_auth_disabled(0.1); aws.ec2.auto_scaling_group.volumes_encrypted(0.1); aws.ec2.snapshot.cross_region_copy_encrypted(0.1)
aws.ec2.volume.in_use_configured,ec2,volume,configuration_and_change_management,medium,ec2.volume.configuration,security.configuration.ec2_volume_in_use_configured,none,"The config rule appears to check EC2 volume configuration while in use, but all candidates focus on encryption, snapshots, or launch templates with no semantic overlap.",aws.ec2.volume.in_use:aws.ec2.volume.cmk_cmek_configured(0.286); aws.ec2.volume.cmk_cmek_configured(0.2); aws.ec2.volume.snapshots_encrypted(0.2); aws.ec2.instance.uses_single_eni:aws.ec2.instance.data_volumes_encrypted_cmek(0.2); ec2.ebs.volume.encryption(0.2)
aws.ec2.volume.protected_by_backup_plan_configured,ec2,volume,resilience_and_disaster_recovery,medium,ec2.volume.backup_recovery,resilience.backup_recovery.ec2_volume_protected_by_backup_plan_configured,none,"The config rule checks for EC2 volumes being protected by a backup plan, while all candidates focus on encryption, snapshots, or management, not backup plan configuration.",aws.ec2.volume.protected_by_backup_plan:aws.ec2.volume.cmk_cmek_configured(0.444); aws.ec2.launch_template.root_volume_encrypted_by_default(0.2); aws.ec2.instance.managed_by_ssm:aws.ec2.instance.data_volumes_encrypted_cmek(0.167); aws.ec2.ebs_encryption_by_default_enabled:aws.ec2.launch_template.root_volume_encrypted_by_default(0.154); aws.ec2.volume.cmk_cmek_configured(0.143)
aws.ecr.resource.repository_encryption_enabled,ecr,resource,data_protection_and_privacy,high,ecr.resource.encryption,data_protection.encryption_rest.ecr_resource_repository_encryption_enabled,none,"The config rule checks for encryption on ECR repositories, but all candidate rules focus on image scanning, replication, lifecycle policies, or access controls, not repository encryption.",aws.ecr.repository_encryption_enabled:aws.ecr.repository.image_scanning_enabled(0.429); aws.ecr.repository.image_scanning_enabled(0.4); aws.ecr.image_scan_on_push_enabled:aws.ecr.repository.image_scanning_enabled(0.2); aws.ecr.repository_scan_on_push_enabled:aws.ecr.repository.image_scanning_enabled(0.2); aws.ecr.replication_configuration.cross_region_encrypted(0.167)
aws.ecs.task_definition_image_source_verification.task_ecs_task_definition_image_source_verification_configured,ecs,task_definition_image_source_verification,configuration_and_change_management,medium,ecs.task_definition_image_source_verification.configuration,security.configuration.ecs_task_definition_image_source_verification_task_ecs_task_definition_image_source_verification_configured,none,"The config rule checks for image source verification on ECS task definitions, but all candidate rules focus on different security controls like read-only filesystems, logging, privileged containers, or public IP assignment.",aws.ecs.task_definition_image_source_verification:aws.ecs.container_instance.read_only_root_filesystem(0.385); aws.ecs.task_definitions_logging_enabled:aws.ecs.container_instance.no_privileged_containers(0.25); aws.ecs.task_definition_logging_enabled:aws.ecs.container_instance.no_privileged_containers(0.25); aws.ecs.task_definitions_logging_block_mode:aws.ecs.container_instance.no_privileged_containers(0.231); aws.ecs.task_sets_assign_public_ip_disabled_check:aws.ecs.container_instance.no_privileged_containers(0.125)
aws.ecs.task_definitions_logging_block_mode.task_definitions_logging_block_mode_configured,ecs,task_definitions_logging_block_mode,logging_monitoring_and_alerting,medium,ecs.task_definitions_logging_block_mode.logging,logging_monitoring.logging.ecs_task_definitions_logging_block_mode_task_definitions_logging_block_mode_configured,none,"The config rule focuses on logging block mode configuration for ECS task definitions, while all candidates address unrelated controls like privileged containers, read-only filesystems, or image verification.",aws.ecs.task_definitions_logging_block_mode:aws.ecs.container_instance.no_privileged_containers(0.364); aws.ecs.task_definitions_logging_enabled:aws.ecs.container_instance.no_privileged_containers(0.273); aws.ecs.task_definition_logging_enabled:aws.ecs.container_instance.no_privileged_containers(0.273); aws.ecs.task_definition_image_source_verification:aws.ecs.container_instance.read_only_root_filesystem(0.133); aws.ecs.task_sets_assign_public_ip_disabled_check:aws.ecs.container_instance.no_privileged_containers(0.062)
aws.efs.resource.multi_az_enabled,efs,resource,configuration_and_change_management,medium,efs.resource.configuration,security.configuration.efs_resource_multi_az_enabled,none,"No candidate rule addresses multi-AZ availability for EFS, which is a distinct control from encryption, backups, snapshots, or network access.",aws.efs.multi_az_enabled:aws.efs.file_system.snapshots_enabled(0.375); efs.have.backup.enabled(0.2); aws.efs.file_system.snapshots_enabled(0.167); efs.encryption.at.rest.enabled(0.167); aws.efs.file_system.encryption_at_rest_enabled(0.125)
aws.efs.user.identity_and_root_directory_enforced,efs,user,configuration_and_change_management,medium,efs.user.configuration,security.configuration.efs_user_identity_and_root_directory_enforced,none,"No candidate rule addresses user identity or root directory configuration for EFS, which is the focus of the given rule.",aws.efs.user.identity_and_root_directory_enforced:aws.efs.file_system.snapshots_enabled(0.417); aws.efs.file_system.private_network_only(0.0); aws.efs.file_system.encryption_at_rest_enabled(0.0); aws.efs.file_system.kms_key_policy_least_privilege(0.0); aws.efs.file_system.snapshots_enabled(0.0)
aws.eip.address.address_enabled,eip,address,configuration_and_change_management,medium,eip.address.configuration,security.configuration.eip_address_address_enabled,none,"The YAML rule is about EIP address configuration, but all candidates are unrelated services like Access Analyzer, Security Hub, Config, GuardDuty, API Gateway, Network Firewall, ELB, EC2, or Cost Explorer.",aws.accessanalyzer.enabled(0.5); securityhub.enabled(0.5); aws.config.configuration_recorder.enabled(0.333); aws.config.configuration_recorder.enabled(0.333); aws.guardduty.detector.detectors_enabled(0.333)
aws.eks.api.cluster_required_allowlist_for_namespace_services,eks,api,configuration_and_change_management,medium,eks.api.configuration,security.configuration.eks_api_cluster_required_allowlist_for_namespace_services,none,"The config rule requires an allowlist for namespace services, but none of the candidate rules address service allowlisting or network policies in EKS.",aws.eks.cluster.default_service_account_automount_disabled(0.182); aws.eks.cluster.service_account_token_signing_enabled(0.182); aws.eks.cluster.profiling_disabled(0.111); aws.eks.cluster.audit_logging_enabled(0.1); aws.eks.cluster.anonymous_auth_disabled(0.1)
aws.eks.api.default_deny_egress_per_namespace_configured,eks,api,configuration_and_change_management,medium,eks.api.configuration,security.configuration.eks_api_default_deny_egress_per_namespace_configured,none,"The YAML rule checks for default deny egress per namespace configuration in EKS API, but none of the candidate rules address network policies, egress controls, or namespace-level security configurations.",aws.eks.cluster.default_service_account_automount_disabled(0.091); aws.eks.node_group.protect_kernel_defaults_enabled(0.091); aws.eks.fargate_profile.protect_kernel_defaults_enabled(0.091); aws.eks.cluster.audit_logging_enabled(0.0); aws.eks.cluster.private_control_plane_endpoint_enabled(0.0)
aws.eks.api.default_deny_ingress_per_namespace_configured,eks,api,configuration_and_change_management,medium,eks.api.configuration,security.configuration.eks_api_default_deny_ingress_per_namespace_configured,none,No candidate rule addresses EKS API server default deny ingress configuration per namespace.,aws.eks.cluster.default_service_account_automount_disabled(0.091); aws.eks.node_group.protect_kernel_defaults_enabled(0.091); aws.eks.fargate_profile.protect_kernel_defaults_enabled(0.091); aws.eks.cluster.audit_logging_enabled(0.0); aws.eks.cluster.private_control_plane_endpoint_enabled(0.0)
aws.eks.api.dns_and_metrics_from_approved_sources_configured,eks,api,configuration_and_change_management,medium,eks.api.configuration,security.configuration.eks_api_dns_and_metrics_from_approved_sources_configured,none,"No candidate rule addresses DNS and metrics sources for EKS API, which is a specific configuration control not covered by the listed add-on, logging, endpoint, or node group rules.",aws.eks.addon.from_trusted_channel(0.1); aws.eks.addon.version_pinned_and_supported(0.091); aws.eks.kubelet_event_record_qps_check:aws.eks.addon.version_pinned_and_supported(0.059); aws.eks.cluster.audit_logging_enabled(0.0); aws.eks.cluster.private_control_plane_endpoint_enabled(0.0)
aws.eks.api.drop_net_raw_and_reduce_caps_configured,eks,api,configuration_and_change_management,medium,eks.api.configuration,security.configuration.eks_api_drop_net_raw_and_reduce_caps_configured,none,No candidate rule addresses EKS API server security configuration for dropping NET_RAW capability and reducing capabilities.,aws.eks.addon.version_pinned_and_supported(0.091); aws.eks.kubelet_event_record_qps_check:aws.eks.addon.version_pinned_and_supported(0.059); aws.eks.cluster.audit_logging_enabled(0.0); aws.eks.cluster.private_control_plane_endpoint_enabled(0.0); aws.eks.cluster.default_service_account_automount_disabled(0.0)
aws.eks.api.env_no_plaintext_secrets_configured,eks,api,configuration_and_change_management,medium,eks.api.configuration,security.configuration.eks_api_env_no_plaintext_secrets_configured,none,"The config rule checks for plaintext secrets in EKS API environment configurations, but no candidate rule addresses secrets in environment variables or API configurations.",aws.eks.addon.no_privileged_permissions(0.125); aws.eks.node_group.nodes_no_public_ip(0.111); aws.eks.nodegroup.nodes_no_public_ip(0.111); aws.eks.cluster.secrets_encryption_kms_cmk:aws.eks.cluster.secrets_encryption_kms_enabled(0.091); eks.cluster.kms.cmk.encryption.in.secrets.enabled(0.091)
aws.eks.api.host_network_pid_ipc_disabled,eks,api,network_security_and_connectivity,high,eks.api.network,network_security.network_access.eks_api_host_network_pid_ipc_disabled,none,"The config rule checks for disabling hostNetwork, hostPID, and hostIPC in EKS pod specs, but no candidate rules address these specific Kubernetes pod security settings.",aws.eks.cluster.profiling_disabled(0.125); aws.eks.cluster.anonymous_auth_disabled(0.111); aws.eks.node_group.anonymous_auth_disabled(0.1); aws.eks.fargate_profile.anonymous_auth_disabled(0.1); aws.eks.cluster.default_service_account_automount_disabled(0.091)
aws.eks.api.image_registry_allowlist_enforced,eks,api,configuration_and_change_management,medium,eks.api.configuration,security.configuration.eks_api_image_registry_allowlist_enforced,none,"None of the candidate rules address EKS API image registry allowlist enforcement, which is a specific security control for restricting container image sources.",aws.eks.cluster.admission_psa_enforce_mode(0.111); aws.eks.cluster.audit_logging_enabled(0.0); aws.eks.cluster.private_control_plane_endpoint_enabled(0.0); aws.eks.cluster.default_service_account_automount_disabled(0.0); aws.eks.node_group.nodes_no_public_ip(0.0)
aws.eks.api.image_signature_verification_enabled,eks,api,configuration_and_change_management,medium,eks.api.configuration,security.configuration.eks_api_image_signature_verification_enabled,none,"None of the candidate rules address image signature verification for EKS API configuration, which is a distinct security control.",aws.eks.cluster.audit_logging_enabled(0.125); aws.eks.nodegroup.disk_encryption_enabled(0.125); aws.eks.nodegroup.workload_identity_enabled(0.125); aws.eks.fargate_profile.logging_enabled(0.125); aws.eks.cluster.secure_port_enabled(0.125)
aws.eks.api.kube_system_services_not_public_configured,eks,api,network_security_and_connectivity,high,eks.api.network,network_security.network_access.eks_api_kube_system_services_not_public_configured,none,"The config rule checks for EKS API kube-system services not being publicly configured, while all candidates address unrelated controls like node group settings, cluster configurations, or addon management.",aws.eks.node_group.nodes_no_public_ip(0.1); aws.eks.nodegroup.nodes_no_public_ip(0.1); aws.eks.cluster.default_service_account_automount_disabled(0.091); aws.eks.cluster.service_account_token_signing_enabled(0.091); aws.eks.cluster.audit_logging_enabled(0.0)
aws.eks.api.no_cluster_admin_to_authenticated_configured,eks,api,configuration_and_change_management,medium,eks.api.configuration,security.configuration.eks_api_no_cluster_admin_to_authenticated_configured,none,"The config rule checks for cluster-admin role binding to authenticated users, which is not covered by any candidate rules focusing on authentication, logging, encryption, or other EKS security controls.",aws.eks.cluster.profiling_disabled(0.125); aws.eks.cluster.audit_logging_enabled(0.111); aws.eks.addon.no_privileged_permissions(0.111); aws.eks.cluster.anonymous_auth_disabled(0.111); aws.eks.cluster.secure_port_enabled(0.111)
aws.eks.api.no_hostpath_mounts_configured,eks,api,configuration_and_change_management,medium,eks.api.configuration,security.configuration.eks_api_no_hostpath_mounts_configured,none,"The config rule checks for hostPath mounts in EKS API configuration, but none of the candidate rules address hostPath mounts or similar volume security controls.",aws.eks.addon.no_privileged_permissions(0.143); aws.eks.node_group.nodes_no_public_ip(0.125); aws.eks.nodegroup.nodes_no_public_ip(0.125); aws.eks.cluster.audit_logging_enabled(0.0); aws.eks.cluster.private_control_plane_endpoint_enabled(0.0)
aws.eks.api.privilege_escalation_denied_configured,eks,api,identity_and_access_management,high,eks.api.access_control,identity_access.least_privilege.eks_api_privilege_escalation_denied_configured,none,"The config rule focuses on EKS API privilege escalation prevention, while all candidates address different EKS controls like Fargate roles, logging, networking, or node security.",aws.eks.fargate_profile.execution_role_least_privilege(0.111); aws.eks.cluster.audit_logging_enabled(0.0); aws.eks.cluster.private_control_plane_endpoint_enabled(0.0); aws.eks.cluster.default_service_account_automount_disabled(0.0); aws.eks.node_group.nodes_no_public_ip(0.0)
aws.eks.api.read_only_root_filesystem_configured,eks,api,configuration_and_change_management,medium,eks.api.configuration,security.configuration.eks_api_read_only_root_filesystem_configured,none,No candidate rule addresses read-only root filesystem configuration for EKS API resources.,aws.eks.node_group.read_only_port_disabled(0.222); aws.eks.fargate_profile.read_only_port_disabled(0.222); aws.eks.node_kubelet_read_only_port_check:aws.eks.node_group.read_only_port_disabled(0.167); aws.eks.fargate_profile.private_subnets_only(0.111); aws.eks.cluster.audit_logging_enabled(0.0)
